{
 "asset_file": null,
 "asset_id": "su-def:0914-meeting:af65e514-836e-4fec-8a99-207e28502185",
 "basis_ko": "이름 Humano4_*, 축척 0.0394(=1/25.4), 인물 그룹(그룹#110·#116·#130·#139) 안의 구성 요소",
 "block": true,
 "card_kind": "definition",
 "class": "person",
 "confidence": 0.7,
 "ifc": {
  "bsdd_uri": "https://identifier.buildingsmart.org/uri/buildingsmart/ifc/4.3/class/IfcBuildingElementProxy",
  "entity": "IfcBuildingElementProxy",
  "predefined_type": "USERDEFINED"
 },
 "level": {
  "base_z_mm": 5158.0,
  "elevation_mm": 5000.0,
  "matched": true,
  "name": "1 FL +5000"
 },
 "materials": [
  {
   "alpha": 1.0,
   "bim_material_category": "paint-or-colour",
   "colour_rgb": [
    55,
    43,
    47
   ],
   "sketchup_material": "Humano4_0034",
   "texture_file": "DiffuseTexture_Humano4_0302_0.jpg",
   "texture_size_mm": [
    25.4,
    25.4
   ]
  }
 ],
 "model": "0914-meeting",
 "parameters": {
  "count": 1,
  "entity_counts": {
   "Edge": 14913,
   "Face": 9942
  },
  "face_area_m2": 1161.481,
  "height_mm": 20734.4,
  "length_mm": 34832.7,
  "thickness_mm": 14514.3,
  "width_mm": 14514.3
 },
 "provenance": {
  "classification": "classification.json",
  "dump": "data/sources/sketchup/0914-meeting/model_dump.json",
  "generator": "scripts/sketchup/build_bim_cards.py"
 },
 "recipe": {
  "child_definitions": [],
  "class_recipe": "data/assets/sketchup/recipes/person.json",
  "guides": [
   {
    "doc": "docs/sketchup/GROUPING-WORKFLOW.ko.md",
    "guide": "component-for-repeats",
    "tools": [
     "sketchup-mcp2.find_components",
     "sketchup-mcp2.get_component_info",
     "sketchup-mcp2.create_component",
     "hueflow.place_component"
    ]
   },
   {
    "doc": "docs/sketchup/GROUPING-WORKFLOW.ko.md",
    "guide": "default-naming",
    "tools": [
     "sketchup-mcp2.list_components",
     "hueflow.list_components",
     "hueflow.execute_ruby"
    ]
   },
   {
    "doc": "docs/sketchup/GROUPING-WORKFLOW.ko.md",
    "guide": "definition-origin",
    "tools": [
     "sketchup-mcp2.get_component_info",
     "hueflow.execute_ruby"
    ]
   },
   {
    "doc": "docs/sketchup/GROUPING-WORKFLOW.ko.md",
    "guide": "step-landscape-people",
    "tools": [
     "hueflow.place_component",
     "sketchup-mcp2.transform_component",
     "hueflow.execute_ruby"
    ]
   },
   {
    "doc": "docs/sketchup/MODELING-GUIDELINES.ko.md",
    "guide": "group-component",
    "tools": [
     "sketchup-mcp2.find_components",
     "sketchup-mcp2.get_component_info",
     "hueflow.list_components",
     "hueflow.place_component",
     "hueflow.execute_ruby"
    ]
   },
   {
    "doc": "docs/sketchup/MODELING-GUIDELINES.ko.md",
    "guide": "people",
    "tools": [
     "hueflow.place_component",
     "sketchup-mcp2.transform_component",
     "sketchup-mcp2.get_component_info"
    ]
   },
   {
    "doc": "docs/sketchup/MODELING-GUIDELINES.ko.md",
    "guide": "agent-judgement",
    "tools": [
     "hueflow.execute_ruby",
     "sketchup-mcp2.find_components"
    ]
   }
  ],
  "method": "component",
  "method_ko": "외부/라이브러리 컴포넌트를 한 블럭으로 배치(내부 분해 금지)",
  "nesting": "definition",
  "ruby_hint": "scripts/sketchup/regroup_0914.rb (태그·레벨·블럭 재구성, 기본 미리보기)",
  "sketchup_kind": "component"
 },
 "review_state": "unverified",
 "schema": "sion-bim-asset/1",
 "source": {
  "definition": "Humano4_1422",
  "guid": "af65e514-836e-4fec-8a99-207e28502185",
  "instance_pids": [
   4236938
  ],
  "instances": 1,
  "kind": "component",
  "source_file": null,
  "used_instances": 1
 },
 "tag": {
  "current": [
   "Layer0"
  ],
  "inner_layers": [
   "Layer0"
  ],
  "proposed_zium": "@FUR"
 }
}
