{
 "asset_file": null,
 "asset_id": "su-def:0914-meeting:67eda779-2d98-40f9-870b-adf017335db9",
 "basis_ko": "이름 없는 하위 그룹으로, 1단계 위 'c3#2'의 분류 'furniture'를 상속(부품으로 추정). 근거: 월드 크기 0.48×0.51×0.60 m, 최소 Z 10,220 mm, 깊이 5, 면 25개, 재질 없음.",
 "block": true,
 "card_kind": "definition",
 "class": "furniture",
 "confidence": 0.55,
 "ifc": {
  "bsdd_uri": "https://identifier.buildingsmart.org/uri/buildingsmart/ifc/4.3/class/IfcFurniture",
  "entity": "IfcFurniture",
  "predefined_type": "CHAIR"
 },
 "level": {
  "base_z_mm": 10220.0,
  "elevation_mm": 10200.0,
  "matched": true,
  "name": "2 FL +10200"
 },
 "materials": [
  {
   "alpha": 1.0,
   "bim_material_category": "wood",
   "colour_rgb": [
    209,
    189,
    171
   ],
   "sketchup_material": "Barham & Sons Benchmark Oak 3060 Staggered 1337 x 1201 mm (FO0WLG)",
   "texture_file": "Barham & Sons Benchmark Oak 3060 Staggered 1337 x 1201 mm (FO0WLG).jpg",
   "texture_size_mm": [
    1337.0,
    1201.2
   ]
  }
 ],
 "model": "0914-meeting",
 "parameters": {
  "count": 8,
  "entity_counts": {
   "Edge": 53,
   "Face": 25
  },
  "face_area_m2": 1.528,
  "height_mm": 600.0,
  "length_mm": 510.0,
  "thickness_mm": 480.0,
  "width_mm": 480.0
 },
 "provenance": {
  "classification": "classification.supplement.json",
  "dump": "data/sources/sketchup/0914-meeting/model_dump.json",
  "generator": "scripts/sketchup/build_bim_cards.py"
 },
 "recipe": {
  "child_definitions": [],
  "class_recipe": "data/assets/sketchup/recipes/furniture.json",
  "guides": [
   {
    "doc": "docs/sketchup/GROUPING-WORKFLOW.ko.md",
    "guide": "grouping-overview",
    "tools": [
     "hueflow.list_entities",
     "hueflow.execute_ruby",
     "sketchup-mcp2.list_components"
    ]
   },
   {
    "doc": "docs/sketchup/GROUPING-WORKFLOW.ko.md",
    "guide": "nest-by-assembly",
    "tools": [
     "hueflow.list_entities",
     "hueflow.execute_ruby"
    ]
   },
   {
    "doc": "docs/sketchup/GROUPING-WORKFLOW.ko.md",
    "guide": "component-for-repeats",
    "tools": [
     "sketchup-mcp2.find_components",
     "sketchup-mcp2.get_component_info",
     "sketchup-mcp2.create_component",
     "hueflow.place_component"
    ]
   },
   {
    "doc": "docs/sketchup/GROUPING-WORKFLOW.ko.md",
    "guide": "default-naming",
    "tools": [
     "sketchup-mcp2.list_components",
     "hueflow.list_components",
     "hueflow.execute_ruby"
    ]
   },
   {
    "doc": "docs/sketchup/GROUPING-WORKFLOW.ko.md",
    "guide": "rotated-frames",
    "tools": [
     "hueflow.rotate_entity",
     "sketchup-mcp2.transform_component",
     "hueflow.execute_ruby"
    ]
   },
   {
    "doc": "docs/sketchup/GROUPING-WORKFLOW.ko.md",
    "guide": "definition-origin",
    "tools": [
     "sketchup-mcp2.get_component_info",
     "hueflow.execute_ruby"
    ]
   },
   {
    "doc": "docs/sketchup/GROUPING-WORKFLOW.ko.md",
    "guide": "step-repeats",
    "tools": [
     "sketchup-mcp2.create_component",
     "sketchup-mcp2.find_components",
     "sketchup-mcp2.transform_component",
     "hueflow.place_component",
     "hueflow.execute_ruby"
    ]
   },
   {
    "doc": "docs/sketchup/GROUPING-WORKFLOW.ko.md",
    "guide": "step-interior",
    "tools": [
     "hueflow.create_group",
     "hueflow.rotate_entity",
     "hueflow.place_component",
     "hueflow.execute_ruby"
    ]
   },
   {
    "doc": "docs/sketchup/MODELING-GUIDELINES.ko.md",
    "guide": "workflow",
    "tools": [
     "hueflow.execute_ruby",
     "sketchup-mcp2.find_components"
    ]
   },
   {
    "doc": "docs/sketchup/MODELING-GUIDELINES.ko.md",
    "guide": "group-component",
    "tools": [
     "sketchup-mcp2.find_components",
     "sketchup-mcp2.get_component_info",
     "hueflow.list_components",
     "hueflow.place_component",
     "hueflow.execute_ruby"
    ]
   },
   {
    "doc": "docs/sketchup/MODELING-GUIDELINES.ko.md",
    "guide": "furniture",
    "tools": [
     "hueflow.place_component",
     "sketchup-mcp2.transform_component",
     "sketchup-mcp2.find_components",
     "hueflow.execute_ruby"
    ]
   },
   {
    "doc": "docs/sketchup/MODELING-GUIDELINES.ko.md",
    "guide": "materials",
    "tools": [
     "hueflow.list_materials",
     "sketchup-mcp2.set_material",
     "hueflow.execute_ruby"
    ]
   },
   {
    "doc": "docs/sketchup/MODELING-GUIDELINES.ko.md",
    "guide": "scenes",
    "tools": [
     "sketchup-mcp2.export_scene",
     "hueflow.execute_ruby"
    ]
   },
   {
    "doc": "docs/sketchup/MODELING-GUIDELINES.ko.md",
    "guide": "qa",
    "tools": [
     "sketchup-mcp2.get_model_info",
     "sketchup-mcp2.list_components",
     "sketchup-mcp2.get_component_info",
     "hueflow.execute_ruby",
     "sketchup-mcp2.export_scene"
    ]
   },
   {
    "doc": "docs/sketchup/MODELING-GUIDELINES.ko.md",
    "guide": "mcp-execution",
    "tools": [
     "sketchup-mcp2.get_model_info",
     "sketchup-mcp2.list_components",
     "sketchup-mcp2.find_components",
     "sketchup-mcp2.get_component_info",
     "sketchup-mcp2.create_component",
     "sketchup-mcp2.transform_component",
     "sketchup-mcp2.set_material",
     "sketchup-mcp2.create_layer",
     "sketchup-mcp2.export_scene",
     "sketchup-mcp2.eval_ruby",
     "sketchup-mcp2.undo",
     "hueflow.execute_ruby",
     "hueflow.create_box",
     "hueflow.create_group",
     "hueflow.place_component",
     "hueflow.list_materials"
    ]
   },
   {
    "doc": "docs/sketchup/MODELING-GUIDELINES.ko.md",
    "guide": "agent-judgement",
    "tools": [
     "hueflow.execute_ruby",
     "sketchup-mcp2.find_components"
    ]
   }
  ],
  "method": "component",
  "method_ko": "외부/라이브러리 컴포넌트를 한 블럭으로 배치(내부 분해 금지)",
  "nesting": "definition",
  "ruby_hint": "scripts/sketchup/regroup_0914.rb (태그·레벨·블럭 재구성, 기본 미리보기)",
  "sketchup_kind": "group"
 },
 "review_state": "unverified",
 "schema": "sion-bim-asset/1",
 "source": {
  "definition": "그룹#170",
  "guid": "67eda779-2d98-40f9-870b-adf017335db9",
  "instance_pids": [
   4303167,
   4303167,
   4303167,
   4303167,
   4303167,
   4303167,
   4303167,
   4303167
  ],
  "instances": 1,
  "kind": "group",
  "source_file": null,
  "used_instances": 8
 },
 "tag": {
  "current": [
   "Layer0"
  ],
  "inner_layers": [
   "Layer0"
  ],
  "proposed_zium": "@FUR"
 }
}
