{
 "asset_file": {
  "bytes": 1835266,
  "root": "SketchUp-Assets/ontology-objects/0914-meeting",
  "sha256": "24bcb6d8f175b3b7ffef8b1209ca8036a67c02e1d681d8920d6cd757f8471629",
  "skp": "objects/planter/그룹_62__4577839.skp",
  "store": "google-drive",
  "thumbnail": "objects/planter/그룹_62__4577839.png",
  "thumbnail_sha256": "41c0e8d295e70c9032b58d99a530b5acd1a61025dd5a1ffc27c92e6c6b6500a3"
 },
 "asset_id": "su-inst:0914-meeting:4577839@456",
 "basis_ko": "정의 카드 su-def:0914-meeting:4ac8ba31-641d-4a2f-b621-897f6ac17c93 분류 상속: 2.2~2.8 m 정사각 박스, 수평 레벨 0/450 mm, 하위에 수목 그룹#74 1개",
 "block": true,
 "card_kind": "instance",
 "class": "planter",
 "confidence": 0.7,
 "definition_ref": "su-def:0914-meeting:4ac8ba31-641d-4a2f-b621-897f6ac17c93",
 "ifc": {
  "bsdd_uri": "https://identifier.buildingsmart.org/uri/buildingsmart/ifc/4.3/class/IfcGeographicElement",
  "entity": "IfcGeographicElement",
  "predefined_type": "USERDEFINED"
 },
 "inside_block": false,
 "level": {
  "base_z_mm": 5000.0,
  "elevation_mm": 5000.0,
  "matched": true,
  "name": "1 FL +5000"
 },
 "materials": [],
 "model": "0914-meeting",
 "parameters": {
  "count": 1,
  "faces_recursive": 942,
  "height_mm": 2435.8,
  "length_mm": 2812.7,
  "thickness_mm": 2435.8,
  "transformation": [
   1.0,
   0.0,
   0.0,
   0.0,
   0.0,
   1.0,
   0.0,
   0.0,
   0.0,
   0.0,
   1.0,
   0.0,
   823.88172,
   670.0792,
   7.87402,
   1.0
  ],
  "width_mm": 2812.5,
  "world_bbox_mm": {
   "max": [
    73034.8,
    18440.2,
    7435.8
   ],
   "min": [
    70222.1,
    15627.7,
    5000.0
   ],
   "size": [
    2812.7,
    2812.5,
    2435.8
   ]
  }
 },
 "provenance": {
  "classification": "hierarchy class_guess / definition card",
  "generator": "scripts/sketchup/build_bim_cards.py",
  "hierarchy": "data/sources/sketchup/0914-meeting/hierarchy.json"
 },
 "recipe": {
  "child_definitions": [],
  "class_recipe": "data/assets/sketchup/recipes/planter.json",
  "guides": [
   {
    "doc": "docs/sketchup/GROUPING-WORKFLOW.ko.md",
    "guide": "step-landscape-people",
    "tools": [
     "hueflow.place_component",
     "sketchup-mcp2.transform_component",
     "hueflow.execute_ruby"
    ]
   },
   {
    "doc": "docs/sketchup/MODELING-GUIDELINES.ko.md",
    "guide": "landscape",
    "tools": [
     "hueflow.place_component",
     "hueflow.execute_ruby",
     "sketchup-mcp2.find_components"
    ]
   },
   {
    "doc": "docs/sketchup/MODELING-GUIDELINES.ko.md",
    "guide": "agent-judgement",
    "tools": [
     "hueflow.execute_ruby",
     "sketchup-mcp2.find_components"
    ]
   }
  ],
  "method": "component",
  "method_ko": "외부/라이브러리 컴포넌트를 한 블럭으로 배치(내부 분해 금지)",
  "nesting": "depth-1",
  "ruby_hint": "scripts/sketchup/regroup_0914.rb (태그·레벨·블럭 재구성, 기본 미리보기)",
  "sketchup_kind": "Group"
 },
 "review_state": "unverified",
 "schema": "sion-bim-asset/1",
 "source": {
  "definition": "그룹#62",
  "depth": 1,
  "hierarchy_locator": "$.nodes[456]",
  "name": null,
  "occurrence": 456,
  "parent_pid": 511546,
  "path": "그룹#201 > 그룹#62",
  "pid": 4577839,
  "type": "Group"
 },
 "tag": {
  "current": [
   "Layer0"
  ],
  "proposed_zium": "Trees 3D"
 }
}
