{
 "asset_file": {
  "bytes": 1419893,
  "root": "SketchUp-Assets/ontology-objects/0914-meeting",
  "sha256": "cd6aa1cb370a231807f2e1dc23e5919e65df28798546994a015972ecfdbdac37",
  "skp": "objects/furniture/ch6__4360625.skp",
  "store": "google-drive",
  "thumbnail": "objects/furniture/ch6__4360625.png",
  "thumbnail_sha256": "295bd1a5778d88ed8aec2683a87abceb32b2f1611b2995ea69104102ee7a747b"
 },
 "asset_id": "su-inst:0914-meeting:4360627@281",
 "basis_ko": "정의 카드 su-def:0914-meeting:0a25473a-6916-48b3-b63b-1ded8234d7fe 분류 상속: 837×1874×577 mm 가죽 좌석 + 스테인리스 레일, 인스턴스 5개(2층)",
 "block": true,
 "card_kind": "instance",
 "class": "furniture",
 "confidence": 0.8,
 "definition_ref": "su-def:0914-meeting:0a25473a-6916-48b3-b63b-1ded8234d7fe",
 "ifc": {
  "bsdd_uri": "https://identifier.buildingsmart.org/uri/buildingsmart/ifc/4.3/class/IfcFurniture",
  "entity": "IfcFurniture",
  "predefined_type": "CHAIR"
 },
 "inside_block": false,
 "level": {
  "base_z_mm": 10220.0,
  "elevation_mm": 10200.0,
  "matched": true,
  "name": "2 FL +10200"
 },
 "materials": [],
 "model": "0914-meeting",
 "parameters": {
  "count": 1,
  "faces_recursive": 1528,
  "height_mm": 576.8,
  "length_mm": 1874.0,
  "thickness_mm": 576.8,
  "transformation": [
   1.0,
   0.0,
   0.0,
   0.0,
   0.0,
   1.0,
   0.0,
   0.0,
   0.0,
   0.0,
   1.0,
   0.0,
   407.49814,
   500.21894,
   12.59843,
   1.0
  ],
  "width_mm": 837.0,
  "world_bbox_mm": {
   "max": [
    70443.7,
    33687.0,
    10796.8
   ],
   "min": [
    69606.7,
    31813.0,
    10220.0
   ],
   "size": [
    837.0,
    1874.0,
    576.8
   ]
  }
 },
 "provenance": {
  "classification": "hierarchy class_guess / definition card",
  "generator": "scripts/sketchup/build_bim_cards.py",
  "hierarchy": "data/sources/sketchup/0914-meeting/hierarchy.json"
 },
 "recipe": {
  "child_definitions": [],
  "class_recipe": "data/assets/sketchup/recipes/furniture.json",
  "guides": [
   {
    "doc": "docs/sketchup/GROUPING-WORKFLOW.ko.md",
    "guide": "grouping-overview",
    "tools": [
     "hueflow.list_entities",
     "hueflow.execute_ruby",
     "sketchup-mcp2.list_components"
    ]
   },
   {
    "doc": "docs/sketchup/GROUPING-WORKFLOW.ko.md",
    "guide": "nest-by-assembly",
    "tools": [
     "hueflow.list_entities",
     "hueflow.execute_ruby"
    ]
   },
   {
    "doc": "docs/sketchup/GROUPING-WORKFLOW.ko.md",
    "guide": "component-for-repeats",
    "tools": [
     "sketchup-mcp2.find_components",
     "sketchup-mcp2.get_component_info",
     "sketchup-mcp2.create_component",
     "hueflow.place_component"
    ]
   },
   {
    "doc": "docs/sketchup/GROUPING-WORKFLOW.ko.md",
    "guide": "default-naming",
    "tools": [
     "sketchup-mcp2.list_components",
     "hueflow.list_components",
     "hueflow.execute_ruby"
    ]
   },
   {
    "doc": "docs/sketchup/GROUPING-WORKFLOW.ko.md",
    "guide": "rotated-frames",
    "tools": [
     "hueflow.rotate_entity",
     "sketchup-mcp2.transform_component",
     "hueflow.execute_ruby"
    ]
   },
   {
    "doc": "docs/sketchup/GROUPING-WORKFLOW.ko.md",
    "guide": "definition-origin",
    "tools": [
     "sketchup-mcp2.get_component_info",
     "hueflow.execute_ruby"
    ]
   },
   {
    "doc": "docs/sketchup/GROUPING-WORKFLOW.ko.md",
    "guide": "step-repeats",
    "tools": [
     "sketchup-mcp2.create_component",
     "sketchup-mcp2.find_components",
     "sketchup-mcp2.transform_component",
     "hueflow.place_component",
     "hueflow.execute_ruby"
    ]
   },
   {
    "doc": "docs/sketchup/GROUPING-WORKFLOW.ko.md",
    "guide": "step-interior",
    "tools": [
     "hueflow.create_group",
     "hueflow.rotate_entity",
     "hueflow.place_component",
     "hueflow.execute_ruby"
    ]
   },
   {
    "doc": "docs/sketchup/MODELING-GUIDELINES.ko.md",
    "guide": "workflow",
    "tools": [
     "hueflow.execute_ruby",
     "sketchup-mcp2.find_components"
    ]
   },
   {
    "doc": "docs/sketchup/MODELING-GUIDELINES.ko.md",
    "guide": "group-component",
    "tools": [
     "sketchup-mcp2.find_components",
     "sketchup-mcp2.get_component_info",
     "hueflow.list_components",
     "hueflow.place_component",
     "hueflow.execute_ruby"
    ]
   },
   {
    "doc": "docs/sketchup/MODELING-GUIDELINES.ko.md",
    "guide": "furniture",
    "tools": [
     "hueflow.place_component",
     "sketchup-mcp2.transform_component",
     "sketchup-mcp2.find_components",
     "hueflow.execute_ruby"
    ]
   },
   {
    "doc": "docs/sketchup/MODELING-GUIDELINES.ko.md",
    "guide": "materials",
    "tools": [
     "hueflow.list_materials",
     "sketchup-mcp2.set_material",
     "hueflow.execute_ruby"
    ]
   },
   {
    "doc": "docs/sketchup/MODELING-GUIDELINES.ko.md",
    "guide": "scenes",
    "tools": [
     "sketchup-mcp2.export_scene",
     "hueflow.execute_ruby"
    ]
   },
   {
    "doc": "docs/sketchup/MODELING-GUIDELINES.ko.md",
    "guide": "qa",
    "tools": [
     "sketchup-mcp2.get_model_info",
     "sketchup-mcp2.list_components",
     "sketchup-mcp2.get_component_info",
     "hueflow.execute_ruby",
     "sketchup-mcp2.export_scene"
    ]
   },
   {
    "doc": "docs/sketchup/MODELING-GUIDELINES.ko.md",
    "guide": "mcp-execution",
    "tools": [
     "sketchup-mcp2.get_model_info",
     "sketchup-mcp2.list_components",
     "sketchup-mcp2.find_components",
     "sketchup-mcp2.get_component_info",
     "sketchup-mcp2.create_component",
     "sketchup-mcp2.transform_component",
     "sketchup-mcp2.set_material",
     "sketchup-mcp2.create_layer",
     "sketchup-mcp2.export_scene",
     "sketchup-mcp2.eval_ruby",
     "sketchup-mcp2.undo",
     "hueflow.execute_ruby",
     "hueflow.create_box",
     "hueflow.create_group",
     "hueflow.place_component",
     "hueflow.list_materials"
    ]
   },
   {
    "doc": "docs/sketchup/MODELING-GUIDELINES.ko.md",
    "guide": "agent-judgement",
    "tools": [
     "hueflow.execute_ruby",
     "sketchup-mcp2.find_components"
    ]
   }
  ],
  "method": "component",
  "method_ko": "외부/라이브러리 컴포넌트를 한 블럭으로 배치(내부 분해 금지)",
  "nesting": "depth-3",
  "ruby_hint": "scripts/sketchup/regroup_0914.rb (태그·레벨·블럭 재구성, 기본 미리보기)",
  "sketchup_kind": "ComponentInstance"
 },
 "review_state": "unverified",
 "schema": "sion-bim-asset/1",
 "source": {
  "definition": "ch6",
  "depth": 3,
  "hierarchy_locator": "$.nodes[281]",
  "name": null,
  "occurrence": 281,
  "parent_pid": 4361373,
  "path": "그룹#201 > 그룹#202 > 그룹#205 > ch6",
  "pid": 4360627,
  "type": "ComponentInstance"
 },
 "tag": {
  "current": [
   "Layer0"
  ],
  "proposed_zium": "@FUR"
 }
}
