{
 "asset_file": {
  "bytes": 29282,
  "root": "SketchUp-Assets/ontology-objects/0914-meeting",
  "sha256": "9bf8bdf9956109aab6e28b1a3ac975612df96214a314bf040cd9f6b6f354c59d",
  "skp": "objects/handrail/그룹357_1__4086194.skp",
  "store": "google-drive",
  "thumbnail": "objects/handrail/그룹357_1__4086194.png",
  "thumbnail_sha256": "b6e7e1951a30e63e40e534f21e0f6a7e8079a9404c93f94f2850ec3526ffcaf1"
 },
 "asset_id": "su-def:0914-meeting:003f6055-3971-4fd9-8643-449025023e8f",
 "basis_ko": "두께 44 mm 판(난간 패널로 추정), 그룹#258의 하위",
 "block": false,
 "card_kind": "definition",
 "class": "handrail",
 "confidence": 0.4,
 "ifc": {
  "bsdd_uri": "https://identifier.buildingsmart.org/uri/buildingsmart/ifc/4.3/class/IfcRailing",
  "entity": "IfcRailing",
  "predefined_type": "HANDRAIL"
 },
 "level": {
  "base_z_mm": 4800.0,
  "elevation_mm": 5000.0,
  "matched": true,
  "name": "1 FL +5000"
 },
 "materials": [],
 "model": "0914-meeting",
 "parameters": {
  "count": 1,
  "entity_counts": {
   "Edge": 178,
   "Face": 70
  },
  "face_area_m2": 1.552,
  "height_mm": 2200.0,
  "length_mm": 1792.0,
  "thickness_mm": 44.0,
  "width_mm": 44.0
 },
 "provenance": {
  "classification": "classification.json",
  "dump": "data/sources/sketchup/0914-meeting/model_dump.json",
  "generator": "scripts/sketchup/build_bim_cards.py"
 },
 "recipe": {
  "child_definitions": [],
  "class_recipe": "data/assets/sketchup/recipes/handrail.json",
  "guides": [
   {
    "doc": "docs/sketchup/GROUPING-WORKFLOW.ko.md",
    "guide": "component-for-repeats",
    "tools": [
     "sketchup-mcp2.find_components",
     "sketchup-mcp2.get_component_info",
     "sketchup-mcp2.create_component",
     "hueflow.place_component"
    ]
   },
   {
    "doc": "docs/sketchup/GROUPING-WORKFLOW.ko.md",
    "guide": "default-naming",
    "tools": [
     "sketchup-mcp2.list_components",
     "hueflow.list_components",
     "hueflow.execute_ruby"
    ]
   },
   {
    "doc": "docs/sketchup/GROUPING-WORKFLOW.ko.md",
    "guide": "tags-on-raw-geometry",
    "tools": [
     "hueflow.list_layers",
     "sketchup-mcp2.list_layers",
     "hueflow.execute_ruby"
    ]
   },
   {
    "doc": "docs/sketchup/GROUPING-WORKFLOW.ko.md",
    "guide": "step-site-assemblies",
    "tools": [
     "hueflow.create_group",
     "hueflow.move_entity",
     "hueflow.rotate_entity",
     "hueflow.execute_ruby"
    ]
   },
   {
    "doc": "docs/sketchup/GROUPING-WORKFLOW.ko.md",
    "guide": "step-repeats",
    "tools": [
     "sketchup-mcp2.create_component",
     "sketchup-mcp2.find_components",
     "sketchup-mcp2.transform_component",
     "hueflow.place_component",
     "hueflow.execute_ruby"
    ]
   },
   {
    "doc": "docs/sketchup/MODELING-GUIDELINES.ko.md",
    "guide": "tags",
    "tools": [
     "hueflow.list_layers",
     "sketchup-mcp2.list_layers",
     "sketchup-mcp2.create_layer",
     "hueflow.execute_ruby"
    ]
   },
   {
    "doc": "docs/sketchup/MODELING-GUIDELINES.ko.md",
    "guide": "group-component",
    "tools": [
     "sketchup-mcp2.find_components",
     "sketchup-mcp2.get_component_info",
     "hueflow.list_components",
     "hueflow.place_component",
     "hueflow.execute_ruby"
    ]
   },
   {
    "doc": "docs/sketchup/MODELING-GUIDELINES.ko.md",
    "guide": "exterior-stair",
    "tools": [
     "hueflow.execute_ruby",
     "hueflow.create_face",
     "hueflow.push_pull"
    ]
   },
   {
    "doc": "docs/sketchup/MODELING-GUIDELINES.ko.md",
    "guide": "railing",
    "tools": [
     "hueflow.follow_me",
     "hueflow.execute_ruby",
     "hueflow.create_circle"
    ]
   },
   {
    "doc": "docs/sketchup/MODELING-GUIDELINES.ko.md",
    "guide": "agent-judgement",
    "tools": [
     "hueflow.execute_ruby",
     "sketchup-mcp2.find_components"
    ]
   }
  ],
  "method": "follow-me",
  "method_ko": "단면(원/사각)을 경로를 따라 Follow-Me로 쓸어 만듦",
  "nesting": "definition",
  "ruby_hint": "scripts/sketchup/regroup_0914.rb (태그·레벨·블럭 재구성, 기본 미리보기)",
  "sketchup_kind": "group"
 },
 "review_state": "unverified",
 "schema": "sion-bim-asset/1",
 "source": {
  "definition": "그룹357#1",
  "guid": "003f6055-3971-4fd9-8643-449025023e8f",
  "instance_pids": [
   4086194
  ],
  "instances": 1,
  "kind": "group",
  "source_file": null,
  "used_instances": 1
 },
 "tag": {
  "current": [
   "Layer0"
  ],
  "inner_layers": [
   "Layer0"
  ],
  "proposed_zium": "@stair"
 }
}
