{
 "asset_file": null,
 "asset_id": "su-inst:0914-meeting:5131578@488",
 "basis_ko": "정의 카드 su-def:0914-meeting:f37046db-2089-44c7-896c-a6cc29d2b462 분류 상속: 수관 면·모서리(재질1·birch-yellow texture2·[Color_D09], Trees 3D 태그 36,338개) + 줄기 컴포넌트 Component#28",
 "block": true,
 "card_kind": "instance",
 "class": "tree",
 "confidence": 0.8,
 "definition_ref": "su-def:0914-meeting:f37046db-2089-44c7-896c-a6cc29d2b462",
 "ifc": {
  "bsdd_uri": "https://identifier.buildingsmart.org/uri/buildingsmart/ifc/4.3/class/IfcGeographicElement",
  "entity": "IfcGeographicElement",
  "predefined_type": "VEGETATION"
 },
 "inside_block": true,
 "level": {
  "base_z_mm": 5000.0,
  "elevation_mm": 5000.0,
  "matched": true,
  "name": "1 FL +5000"
 },
 "materials": [],
 "model": "0914-meeting",
 "parameters": {
  "count": 1,
  "faces_recursive": 936,
  "height_mm": 3707.8,
  "length_mm": 3751.9,
  "thickness_mm": 3707.8,
  "transformation": [
   -0.29669,
   0.30723,
   0.0,
   0.0,
   -0.30723,
   -0.29669,
   0.0,
   0.0,
   0.0,
   0.0,
   0.457,
   0.0,
   581.96837,
   94.16495,
   0.0,
   1.0
  ],
  "width_mm": 3751.8,
  "world_bbox_mm": {
   "max": [
    72689.4,
    8080.7,
    8707.8
   ],
   "min": [
    68937.4,
    4328.9,
    5000.0
   ],
   "size": [
    3751.9,
    3751.8,
    3707.8
   ]
  }
 },
 "provenance": {
  "classification": "hierarchy class_guess / definition card",
  "generator": "scripts/sketchup/build_bim_cards.py",
  "hierarchy": "data/sources/sketchup/0914-meeting/hierarchy.json"
 },
 "recipe": {
  "child_definitions": [],
  "class_recipe": "data/assets/sketchup/recipes/tree.json",
  "guides": [
   {
    "doc": "docs/sketchup/GROUPING-WORKFLOW.ko.md",
    "guide": "grouping-overview",
    "tools": [
     "hueflow.list_entities",
     "hueflow.execute_ruby",
     "sketchup-mcp2.list_components"
    ]
   },
   {
    "doc": "docs/sketchup/GROUPING-WORKFLOW.ko.md",
    "guide": "top-split-by-part",
    "tools": [
     "hueflow.list_entities",
     "sketchup-mcp2.list_components"
    ]
   },
   {
    "doc": "docs/sketchup/GROUPING-WORKFLOW.ko.md",
    "guide": "component-for-repeats",
    "tools": [
     "sketchup-mcp2.find_components",
     "sketchup-mcp2.get_component_info",
     "sketchup-mcp2.create_component",
     "hueflow.place_component"
    ]
   },
   {
    "doc": "docs/sketchup/GROUPING-WORKFLOW.ko.md",
    "guide": "tags-on-raw-geometry",
    "tools": [
     "hueflow.list_layers",
     "sketchup-mcp2.list_layers",
     "hueflow.execute_ruby"
    ]
   },
   {
    "doc": "docs/sketchup/GROUPING-WORKFLOW.ko.md",
    "guide": "step-repeats",
    "tools": [
     "sketchup-mcp2.create_component",
     "sketchup-mcp2.find_components",
     "sketchup-mcp2.transform_component",
     "hueflow.place_component",
     "hueflow.execute_ruby"
    ]
   },
   {
    "doc": "docs/sketchup/GROUPING-WORKFLOW.ko.md",
    "guide": "step-landscape-people",
    "tools": [
     "hueflow.place_component",
     "sketchup-mcp2.transform_component",
     "hueflow.execute_ruby"
    ]
   },
   {
    "doc": "docs/sketchup/MODELING-GUIDELINES.ko.md",
    "guide": "workflow",
    "tools": [
     "hueflow.execute_ruby",
     "sketchup-mcp2.find_components"
    ]
   },
   {
    "doc": "docs/sketchup/MODELING-GUIDELINES.ko.md",
    "guide": "tags",
    "tools": [
     "hueflow.list_layers",
     "sketchup-mcp2.list_layers",
     "sketchup-mcp2.create_layer",
     "hueflow.execute_ruby"
    ]
   },
   {
    "doc": "docs/sketchup/MODELING-GUIDELINES.ko.md",
    "guide": "group-component",
    "tools": [
     "sketchup-mcp2.find_components",
     "sketchup-mcp2.get_component_info",
     "hueflow.list_components",
     "hueflow.place_component",
     "hueflow.execute_ruby"
    ]
   },
   {
    "doc": "docs/sketchup/MODELING-GUIDELINES.ko.md",
    "guide": "landscape",
    "tools": [
     "hueflow.place_component",
     "hueflow.execute_ruby",
     "sketchup-mcp2.find_components"
    ]
   },
   {
    "doc": "docs/sketchup/MODELING-GUIDELINES.ko.md",
    "guide": "qa",
    "tools": [
     "sketchup-mcp2.get_model_info",
     "sketchup-mcp2.list_components",
     "sketchup-mcp2.get_component_info",
     "hueflow.execute_ruby",
     "sketchup-mcp2.export_scene"
    ]
   },
   {
    "doc": "docs/sketchup/MODELING-GUIDELINES.ko.md",
    "guide": "mcp-execution",
    "tools": [
     "sketchup-mcp2.get_model_info",
     "sketchup-mcp2.list_components",
     "sketchup-mcp2.find_components",
     "sketchup-mcp2.get_component_info",
     "sketchup-mcp2.create_component",
     "sketchup-mcp2.transform_component",
     "sketchup-mcp2.set_material",
     "sketchup-mcp2.create_layer",
     "sketchup-mcp2.export_scene",
     "sketchup-mcp2.eval_ruby",
     "sketchup-mcp2.undo",
     "hueflow.execute_ruby",
     "hueflow.create_box",
     "hueflow.create_group",
     "hueflow.place_component",
     "hueflow.list_materials"
    ]
   },
   {
    "doc": "docs/sketchup/MODELING-GUIDELINES.ko.md",
    "guide": "agent-judgement",
    "tools": [
     "hueflow.execute_ruby",
     "sketchup-mcp2.find_components"
    ]
   }
  ],
  "method": "component",
  "method_ko": "외부/라이브러리 컴포넌트를 한 블럭으로 배치(내부 분해 금지)",
  "nesting": "inside-block",
  "ruby_hint": "scripts/sketchup/regroup_0914.rb (태그·레벨·블럭 재구성, 기본 미리보기)",
  "sketchup_kind": "Group"
 },
 "review_state": "unverified",
 "schema": "sion-bim-asset/1",
 "source": {
  "definition": "그룹#74",
  "depth": 1,
  "hierarchy_locator": "$.nodes[488]",
  "name": null,
  "occurrence": 488,
  "parent_pid": 800070,
  "path": "그룹#65 > 그룹#74",
  "pid": 5131578,
  "type": "Group"
 },
 "tag": {
  "current": [
   "Layer0"
  ],
  "proposed_zium": "Trees 3D"
 }
}
