{
 "asset_file": null,
 "asset_id": "su-inst:0914-meeting:4360579@365",
 "basis_ko": "이름 없는 하위 그룹으로, 1단계 위 'ch5'의 분류 'furniture'를 상속(부품으로 추정). 근거: 월드 크기 0.63×0.61×0.75 m, 최소 Z 10,220 mm, 깊이 5, 면 4742개, 재질 없음.",
 "block": false,
 "card_kind": "instance",
 "class": "furniture",
 "confidence": 0.55,
 "definition_ref": "su-def:0914-meeting:4f1924d3-c519-4582-9d12-345c9c7eee41",
 "ifc": {
  "bsdd_uri": "https://identifier.buildingsmart.org/uri/buildingsmart/ifc/4.3/class/IfcFurniture",
  "entity": "IfcFurniture",
  "predefined_type": "CHAIR"
 },
 "inside_block": true,
 "level": {
  "base_z_mm": 10220.0,
  "elevation_mm": 10200.0,
  "matched": true,
  "name": "2 FL +10200"
 },
 "materials": [],
 "model": "0914-meeting",
 "parameters": {
  "count": 1,
  "faces_recursive": 4742,
  "height_mm": 745.4,
  "length_mm": 630.0,
  "thickness_mm": 610.0,
  "transformation": [
   1.0,
   0.0,
   0.0,
   0.0,
   0.0,
   1.0,
   0.0,
   0.0,
   0.0,
   0.0,
   1.0,
   0.0,
   0.0,
   0.0,
   0.0,
   1.0
  ],
  "width_mm": 610.0,
  "world_bbox_mm": {
   "max": [
    64443.7,
    28350.0,
    10965.4
   ],
   "min": [
    63813.7,
    27740.0,
    10220.0
   ],
   "size": [
    630.0,
    610.0,
    745.4
   ]
  }
 },
 "provenance": {
  "classification": "classification.supplement.json",
  "generator": "scripts/sketchup/build_bim_cards.py",
  "hierarchy": "data/sources/sketchup/0914-meeting/hierarchy.json"
 },
 "recipe": {
  "child_definitions": [],
  "class_recipe": "data/assets/sketchup/recipes/furniture.json",
  "guides": [
   {
    "doc": "docs/sketchup/GROUPING-WORKFLOW.ko.md",
    "guide": "grouping-overview",
    "tools": [
     "hueflow.list_entities",
     "hueflow.execute_ruby",
     "sketchup-mcp2.list_components"
    ]
   },
   {
    "doc": "docs/sketchup/GROUPING-WORKFLOW.ko.md",
    "guide": "nest-by-assembly",
    "tools": [
     "hueflow.list_entities",
     "hueflow.execute_ruby"
    ]
   },
   {
    "doc": "docs/sketchup/GROUPING-WORKFLOW.ko.md",
    "guide": "component-for-repeats",
    "tools": [
     "sketchup-mcp2.find_components",
     "sketchup-mcp2.get_component_info",
     "sketchup-mcp2.create_component",
     "hueflow.place_component"
    ]
   },
   {
    "doc": "docs/sketchup/GROUPING-WORKFLOW.ko.md",
    "guide": "default-naming",
    "tools": [
     "sketchup-mcp2.list_components",
     "hueflow.list_components",
     "hueflow.execute_ruby"
    ]
   },
   {
    "doc": "docs/sketchup/GROUPING-WORKFLOW.ko.md",
    "guide": "rotated-frames",
    "tools": [
     "hueflow.rotate_entity",
     "sketchup-mcp2.transform_component",
     "hueflow.execute_ruby"
    ]
   },
   {
    "doc": "docs/sketchup/GROUPING-WORKFLOW.ko.md",
    "guide": "definition-origin",
    "tools": [
     "sketchup-mcp2.get_component_info",
     "hueflow.execute_ruby"
    ]
   },
   {
    "doc": "docs/sketchup/GROUPING-WORKFLOW.ko.md",
    "guide": "step-repeats",
    "tools": [
     "sketchup-mcp2.create_component",
     "sketchup-mcp2.find_components",
     "sketchup-mcp2.transform_component",
     "hueflow.place_component",
     "hueflow.execute_ruby"
    ]
   },
   {
    "doc": "docs/sketchup/GROUPING-WORKFLOW.ko.md",
    "guide": "step-interior",
    "tools": [
     "hueflow.create_group",
     "hueflow.rotate_entity",
     "hueflow.place_component",
     "hueflow.execute_ruby"
    ]
   },
   {
    "doc": "docs/sketchup/MODELING-GUIDELINES.ko.md",
    "guide": "workflow",
    "tools": [
     "hueflow.execute_ruby",
     "sketchup-mcp2.find_components"
    ]
   },
   {
    "doc": "docs/sketchup/MODELING-GUIDELINES.ko.md",
    "guide": "group-component",
    "tools": [
     "sketchup-mcp2.find_components",
     "sketchup-mcp2.get_component_info",
     "hueflow.list_components",
     "hueflow.place_component",
     "hueflow.execute_ruby"
    ]
   },
   {
    "doc": "docs/sketchup/MODELING-GUIDELINES.ko.md",
    "guide": "furniture",
    "tools": [
     "hueflow.place_component",
     "sketchup-mcp2.transform_component",
     "sketchup-mcp2.find_components",
     "hueflow.execute_ruby"
    ]
   },
   {
    "doc": "docs/sketchup/MODELING-GUIDELINES.ko.md",
    "guide": "materials",
    "tools": [
     "hueflow.list_materials",
     "sketchup-mcp2.set_material",
     "hueflow.execute_ruby"
    ]
   },
   {
    "doc": "docs/sketchup/MODELING-GUIDELINES.ko.md",
    "guide": "scenes",
    "tools": [
     "sketchup-mcp2.export_scene",
     "hueflow.execute_ruby"
    ]
   },
   {
    "doc": "docs/sketchup/MODELING-GUIDELINES.ko.md",
    "guide": "qa",
    "tools": [
     "sketchup-mcp2.get_model_info",
     "sketchup-mcp2.list_components",
     "sketchup-mcp2.get_component_info",
     "hueflow.execute_ruby",
     "sketchup-mcp2.export_scene"
    ]
   },
   {
    "doc": "docs/sketchup/MODELING-GUIDELINES.ko.md",
    "guide": "mcp-execution",
    "tools": [
     "sketchup-mcp2.get_model_info",
     "sketchup-mcp2.list_components",
     "sketchup-mcp2.find_components",
     "sketchup-mcp2.get_component_info",
     "sketchup-mcp2.create_component",
     "sketchup-mcp2.transform_component",
     "sketchup-mcp2.set_material",
     "sketchup-mcp2.create_layer",
     "sketchup-mcp2.export_scene",
     "sketchup-mcp2.eval_ruby",
     "sketchup-mcp2.undo",
     "hueflow.execute_ruby",
     "hueflow.create_box",
     "hueflow.create_group",
     "hueflow.place_component",
     "hueflow.list_materials"
    ]
   },
   {
    "doc": "docs/sketchup/MODELING-GUIDELINES.ko.md",
    "guide": "agent-judgement",
    "tools": [
     "hueflow.execute_ruby",
     "sketchup-mcp2.find_components"
    ]
   }
  ],
  "method": "component",
  "method_ko": "외부/라이브러리 컴포넌트를 한 블럭으로 배치(내부 분해 금지)",
  "nesting": "inside-block",
  "ruby_hint": "scripts/sketchup/regroup_0914.rb (태그·레벨·블럭 재구성, 기본 미리보기)",
  "sketchup_kind": "Group"
 },
 "review_state": "unverified",
 "schema": "sion-bim-asset/1",
 "source": {
  "definition": "그룹#175",
  "depth": 5,
  "hierarchy_locator": "$.nodes[365]",
  "name": null,
  "occurrence": 365,
  "parent_pid": 4360581,
  "path": "그룹#201 > 그룹#202 > 그룹#205 > 그룹#232 > ch5 > 그룹#175",
  "pid": 4360579,
  "type": "Group"
 },
 "tag": {
  "current": [
   "Layer0"
  ],
  "proposed_zium": "@FUR"
 }
}
