{
 "asset_file": null,
 "asset_id": "su-def:0914-meeting:0e1742be-dc07-4fe2-b33e-231773669c83",
 "basis_ko": "DimGray 프레임 + Blue Glass, 120×3340×1390 mm",
 "block": false,
 "card_kind": "definition",
 "class": "window-louver",
 "confidence": 0.6,
 "ifc": {
  "bsdd_uri": "https://identifier.buildingsmart.org/uri/buildingsmart/ifc/4.3/class/IfcWindow",
  "entity": "IfcWindow",
  "predefined_type": "WINDOW"
 },
 "level": {
  "base_z_mm": 10480.0,
  "elevation_mm": 10200.0,
  "matched": true,
  "name": "2 FL +10200"
 },
 "materials": [
  {
   "alpha": 0.6,
   "bim_material_category": "glass",
   "colour_rgb": [
    155,
    155,
    155
   ],
   "sketchup_material": "Blue Glass",
   "texture_file": null,
   "texture_size_mm": null
  },
  {
   "alpha": 1.0,
   "bim_material_category": "paint-or-colour",
   "colour_rgb": [
    114,
    114,
    114
   ],
   "sketchup_material": "DimGray",
   "texture_file": null,
   "texture_size_mm": null
  }
 ],
 "model": "0914-meeting",
 "parameters": {
  "count": 1,
  "entity_counts": {
   "Edge": 68,
   "Face": 31
  },
  "face_area_m2": 6.864,
  "height_mm": 1390.0,
  "length_mm": 3340.0,
  "thickness_mm": 120.0,
  "width_mm": 120.0
 },
 "provenance": {
  "classification": "classification.json",
  "dump": "data/sources/sketchup/0914-meeting/model_dump.json",
  "generator": "scripts/sketchup/build_bim_cards.py"
 },
 "recipe": {
  "child_definitions": [],
  "class_recipe": "data/assets/sketchup/recipes/window-louver.json",
  "guides": [
   {
    "doc": "docs/sketchup/GROUPING-WORKFLOW.ko.md",
    "guide": "nest-by-assembly",
    "tools": [
     "hueflow.list_entities",
     "hueflow.execute_ruby"
    ]
   },
   {
    "doc": "docs/sketchup/GROUPING-WORKFLOW.ko.md",
    "guide": "component-for-repeats",
    "tools": [
     "sketchup-mcp2.find_components",
     "sketchup-mcp2.get_component_info",
     "sketchup-mcp2.create_component",
     "hueflow.place_component"
    ]
   },
   {
    "doc": "docs/sketchup/GROUPING-WORKFLOW.ko.md",
    "guide": "rotated-frames",
    "tools": [
     "hueflow.rotate_entity",
     "sketchup-mcp2.transform_component",
     "hueflow.execute_ruby"
    ]
   },
   {
    "doc": "docs/sketchup/GROUPING-WORKFLOW.ko.md",
    "guide": "glue-and-cut",
    "tools": [
     "hueflow.execute_ruby",
     "sketchup-mcp2.get_component_info"
    ]
   },
   {
    "doc": "docs/sketchup/GROUPING-WORKFLOW.ko.md",
    "guide": "step-envelope-assemblies",
    "tools": [
     "hueflow.execute_ruby",
     "hueflow.create_group",
     "sketchup-mcp2.create_component"
    ]
   },
   {
    "doc": "docs/sketchup/MODELING-GUIDELINES.ko.md",
    "guide": "doors-windows",
    "tools": [
     "hueflow.execute_ruby",
     "sketchup-mcp2.create_component",
     "hueflow.place_component"
    ]
   },
   {
    "doc": "docs/sketchup/MODELING-GUIDELINES.ko.md",
    "guide": "agent-judgement",
    "tools": [
     "hueflow.execute_ruby",
     "sketchup-mcp2.find_components"
    ]
   }
  ],
  "method": "array",
  "method_ko": "단위 부재(단·멀리언·패널) 하나를 그룹으로 만든 뒤 복사 배열(Move+Ctrl, xN)",
  "nesting": "definition",
  "ruby_hint": "scripts/sketchup/regroup_0914.rb (태그·레벨·블럭 재구성, 기본 미리보기)",
  "sketchup_kind": "group"
 },
 "review_state": "unverified",
 "schema": "sion-bim-asset/1",
 "source": {
  "definition": "그룹#86",
  "guid": "0e1742be-dc07-4fe2-b33e-231773669c83",
  "instance_pids": [
   4163659
  ],
  "instances": 1,
  "kind": "group",
  "source_file": null,
  "used_instances": 1
 },
 "tag": {
  "current": [
   "Layer0"
  ],
  "inner_layers": [
   "Layer0"
  ],
  "proposed_zium": "@win"
 }
}
