{
 "asset_file": null,
 "asset_id": "su-inst:0914-meeting:4889045@589",
 "basis_ko": "정의 카드 su-def:0914-meeting:969e5931-1d33-4ec0-bbf1-be9bdd627867 분류 상속: 그룹 재질 Travertine (ZUB1YX), 4840×3100×4452 mm, 내부계단 그룹#111 안의 벽",
 "block": false,
 "card_kind": "instance",
 "class": "wall",
 "confidence": 0.5,
 "definition_ref": "su-def:0914-meeting:969e5931-1d33-4ec0-bbf1-be9bdd627867",
 "ifc": {
  "bsdd_uri": "https://identifier.buildingsmart.org/uri/buildingsmart/ifc/4.3/class/IfcWall",
  "entity": "IfcWall",
  "predefined_type": "STANDARD"
 },
 "inside_block": true,
 "level": {
  "base_z_mm": 5000.0,
  "elevation_mm": 5000.0,
  "matched": true,
  "name": "1 FL +5000"
 },
 "materials": [
  {
   "alpha": 1.0,
   "bim_material_category": "stone",
   "colour_rgb": [
    203,
    197,
    182
   ],
   "sketchup_material": "Travertine (ZUB1YX)",
   "texture_file": "Travertine (ZUB1YX).jpg",
   "texture_size_mm": [
    2000.0,
    1524.0
   ]
  }
 ],
 "model": "0914-meeting",
 "parameters": {
  "count": 1,
  "faces_recursive": 9,
  "height_mm": 4451.8,
  "length_mm": 4840.0,
  "thickness_mm": 3100.0,
  "transformation": [
   1.0,
   0.0,
   0.0,
   0.0,
   0.0,
   1.0,
   0.0,
   0.0,
   0.0,
   0.0,
   1.0,
   0.0,
   231.69291,
   31.88976,
   0.0,
   1.0
  ],
  "width_mm": 3100.0,
  "world_bbox_mm": {
   "max": [
    76321.3,
    42507.4,
    9451.8
   ],
   "min": [
    71481.3,
    39407.4,
    5000.0
   ],
   "size": [
    4840.0,
    3100.0,
    4451.8
   ]
  }
 },
 "provenance": {
  "classification": "hierarchy class_guess / definition card",
  "generator": "scripts/sketchup/build_bim_cards.py",
  "hierarchy": "data/sources/sketchup/0914-meeting/hierarchy.json"
 },
 "recipe": {
  "child_definitions": [],
  "class_recipe": "data/assets/sketchup/recipes/wall.json",
  "guides": [
   {
    "doc": "docs/sketchup/GROUPING-WORKFLOW.ko.md",
    "guide": "step-site-assemblies",
    "tools": [
     "hueflow.create_group",
     "hueflow.move_entity",
     "hueflow.rotate_entity",
     "hueflow.execute_ruby"
    ]
   },
   {
    "doc": "docs/sketchup/GROUPING-WORKFLOW.ko.md",
    "guide": "step-envelope-assemblies",
    "tools": [
     "hueflow.execute_ruby",
     "hueflow.create_group",
     "sketchup-mcp2.create_component"
    ]
   },
   {
    "doc": "docs/sketchup/MODELING-GUIDELINES.ko.md",
    "guide": "workflow",
    "tools": [
     "hueflow.execute_ruby",
     "sketchup-mcp2.find_components"
    ]
   },
   {
    "doc": "docs/sketchup/MODELING-GUIDELINES.ko.md",
    "guide": "exterior-stair",
    "tools": [
     "hueflow.execute_ruby",
     "hueflow.create_face",
     "hueflow.push_pull"
    ]
   },
   {
    "doc": "docs/sketchup/MODELING-GUIDELINES.ko.md",
    "guide": "wall",
    "tools": [
     "hueflow.create_box",
     "hueflow.create_face",
     "hueflow.push_pull",
     "hueflow.execute_ruby"
    ]
   },
   {
    "doc": "docs/sketchup/MODELING-GUIDELINES.ko.md",
    "guide": "materials",
    "tools": [
     "hueflow.list_materials",
     "sketchup-mcp2.set_material",
     "hueflow.execute_ruby"
    ]
   },
   {
    "doc": "docs/sketchup/MODELING-GUIDELINES.ko.md",
    "guide": "qa",
    "tools": [
     "sketchup-mcp2.get_model_info",
     "sketchup-mcp2.list_components",
     "sketchup-mcp2.get_component_info",
     "hueflow.execute_ruby",
     "sketchup-mcp2.export_scene"
    ]
   },
   {
    "doc": "docs/sketchup/MODELING-GUIDELINES.ko.md",
    "guide": "mcp-execution",
    "tools": [
     "sketchup-mcp2.get_model_info",
     "sketchup-mcp2.list_components",
     "sketchup-mcp2.find_components",
     "sketchup-mcp2.get_component_info",
     "sketchup-mcp2.create_component",
     "sketchup-mcp2.transform_component",
     "sketchup-mcp2.set_material",
     "sketchup-mcp2.create_layer",
     "sketchup-mcp2.export_scene",
     "sketchup-mcp2.eval_ruby",
     "sketchup-mcp2.undo",
     "hueflow.execute_ruby",
     "hueflow.create_box",
     "hueflow.create_group",
     "hueflow.place_component",
     "hueflow.list_materials"
    ]
   },
   {
    "doc": "docs/sketchup/MODELING-GUIDELINES.ko.md",
    "guide": "agent-judgement",
    "tools": [
     "hueflow.execute_ruby",
     "sketchup-mcp2.find_components"
    ]
   }
  ],
  "method": "extrude",
  "method_ko": "평면 윤곽을 그린 뒤 push/pull로 두께·높이만큼 돌출",
  "nesting": "inside-block",
  "ruby_hint": "scripts/sketchup/regroup_0914.rb (태그·레벨·블럭 재구성, 기본 미리보기)",
  "sketchup_kind": "Group"
 },
 "review_state": "unverified",
 "schema": "sion-bim-asset/1",
 "source": {
  "definition": "그룹#157",
  "depth": 3,
  "hierarchy_locator": "$.nodes[589]",
  "name": null,
  "occurrence": 589,
  "parent_pid": 4905043,
  "path": "그룹#105 > 그룹#160 > 그룹#111 > 그룹#157",
  "pid": 4889045,
  "type": "Group"
 },
 "tag": {
  "current": [
   "Layer0"
  ],
  "proposed_zium": "A-본동"
 }
}
