{
 "asset_file": {
  "bytes": 929890,
  "root": "SketchUp-Assets/ontology-objects/0914-meeting",
  "sha256": "7f3c26c912ac14a04ea18f7297642a3ea2d213d8e6271f20884c7fc00cd26f6d",
  "skp": "objects/furniture/ch5__4360622.skp",
  "store": "google-drive",
  "thumbnail": "objects/furniture/ch5__4360622.png",
  "thumbnail_sha256": "2b05a665843a4adf72e10ac129231e561d06e7ba7a969a7304e9b7a54540389a"
 },
 "asset_id": "su-def:0914-meeting:91051e0d-e839-4d1b-bd50-77cb9f8126b1",
 "basis_ko": "1590×630×745 mm 벤치형 좌석, 인스턴스 11개(2층)",
 "block": true,
 "card_kind": "definition",
 "class": "furniture",
 "confidence": 0.8,
 "ifc": {
  "bsdd_uri": "https://identifier.buildingsmart.org/uri/buildingsmart/ifc/4.3/class/IfcFurniture",
  "entity": "IfcFurniture",
  "predefined_type": "CHAIR"
 },
 "level": {
  "base_z_mm": 10220.0,
  "elevation_mm": 10200.0,
  "matched": true,
  "name": "2 FL +10200"
 },
 "materials": [],
 "model": "0914-meeting",
 "parameters": {
  "count": 11,
  "entity_counts": {
   "Group": 3
  },
  "face_area_m2": 0.0,
  "height_mm": 745.4,
  "length_mm": 1590.0,
  "thickness_mm": 630.0,
  "width_mm": 630.0
 },
 "provenance": {
  "classification": "classification.json",
  "dump": "data/sources/sketchup/0914-meeting/model_dump.json",
  "generator": "scripts/sketchup/build_bim_cards.py"
 },
 "recipe": {
  "child_definitions": [
   "그룹#175",
   "그룹#197",
   "그룹#98"
  ],
  "class_recipe": "data/assets/sketchup/recipes/furniture.json",
  "guides": [
   {
    "doc": "docs/sketchup/GROUPING-WORKFLOW.ko.md",
    "guide": "grouping-overview",
    "tools": [
     "hueflow.list_entities",
     "hueflow.execute_ruby",
     "sketchup-mcp2.list_components"
    ]
   },
   {
    "doc": "docs/sketchup/GROUPING-WORKFLOW.ko.md",
    "guide": "nest-by-assembly",
    "tools": [
     "hueflow.list_entities",
     "hueflow.execute_ruby"
    ]
   },
   {
    "doc": "docs/sketchup/GROUPING-WORKFLOW.ko.md",
    "guide": "component-for-repeats",
    "tools": [
     "sketchup-mcp2.find_components",
     "sketchup-mcp2.get_component_info",
     "sketchup-mcp2.create_component",
     "hueflow.place_component"
    ]
   },
   {
    "doc": "docs/sketchup/GROUPING-WORKFLOW.ko.md",
    "guide": "default-naming",
    "tools": [
     "sketchup-mcp2.list_components",
     "hueflow.list_components",
     "hueflow.execute_ruby"
    ]
   },
   {
    "doc": "docs/sketchup/GROUPING-WORKFLOW.ko.md",
    "guide": "rotated-frames",
    "tools": [
     "hueflow.rotate_entity",
     "sketchup-mcp2.transform_component",
     "hueflow.execute_ruby"
    ]
   },
   {
    "doc": "docs/sketchup/GROUPING-WORKFLOW.ko.md",
    "guide": "definition-origin",
    "tools": [
     "sketchup-mcp2.get_component_info",
     "hueflow.execute_ruby"
    ]
   },
   {
    "doc": "docs/sketchup/GROUPING-WORKFLOW.ko.md",
    "guide": "step-repeats",
    "tools": [
     "sketchup-mcp2.create_component",
     "sketchup-mcp2.find_components",
     "sketchup-mcp2.transform_component",
     "hueflow.place_component",
     "hueflow.execute_ruby"
    ]
   },
   {
    "doc": "docs/sketchup/GROUPING-WORKFLOW.ko.md",
    "guide": "step-interior",
    "tools": [
     "hueflow.create_group",
     "hueflow.rotate_entity",
     "hueflow.place_component",
     "hueflow.execute_ruby"
    ]
   },
   {
    "doc": "docs/sketchup/MODELING-GUIDELINES.ko.md",
    "guide": "workflow",
    "tools": [
     "hueflow.execute_ruby",
     "sketchup-mcp2.find_components"
    ]
   },
   {
    "doc": "docs/sketchup/MODELING-GUIDELINES.ko.md",
    "guide": "group-component",
    "tools": [
     "sketchup-mcp2.find_components",
     "sketchup-mcp2.get_component_info",
     "hueflow.list_components",
     "hueflow.place_component",
     "hueflow.execute_ruby"
    ]
   },
   {
    "doc": "docs/sketchup/MODELING-GUIDELINES.ko.md",
    "guide": "furniture",
    "tools": [
     "hueflow.place_component",
     "sketchup-mcp2.transform_component",
     "sketchup-mcp2.find_components",
     "hueflow.execute_ruby"
    ]
   },
   {
    "doc": "docs/sketchup/MODELING-GUIDELINES.ko.md",
    "guide": "materials",
    "tools": [
     "hueflow.list_materials",
     "sketchup-mcp2.set_material",
     "hueflow.execute_ruby"
    ]
   },
   {
    "doc": "docs/sketchup/MODELING-GUIDELINES.ko.md",
    "guide": "scenes",
    "tools": [
     "sketchup-mcp2.export_scene",
     "hueflow.execute_ruby"
    ]
   },
   {
    "doc": "docs/sketchup/MODELING-GUIDELINES.ko.md",
    "guide": "qa",
    "tools": [
     "sketchup-mcp2.get_model_info",
     "sketchup-mcp2.list_components",
     "sketchup-mcp2.get_component_info",
     "hueflow.execute_ruby",
     "sketchup-mcp2.export_scene"
    ]
   },
   {
    "doc": "docs/sketchup/MODELING-GUIDELINES.ko.md",
    "guide": "mcp-execution",
    "tools": [
     "sketchup-mcp2.get_model_info",
     "sketchup-mcp2.list_components",
     "sketchup-mcp2.find_components",
     "sketchup-mcp2.get_component_info",
     "sketchup-mcp2.create_component",
     "sketchup-mcp2.transform_component",
     "sketchup-mcp2.set_material",
     "sketchup-mcp2.create_layer",
     "sketchup-mcp2.export_scene",
     "sketchup-mcp2.eval_ruby",
     "sketchup-mcp2.undo",
     "hueflow.execute_ruby",
     "hueflow.create_box",
     "hueflow.create_group",
     "hueflow.place_component",
     "hueflow.list_materials"
    ]
   },
   {
    "doc": "docs/sketchup/MODELING-GUIDELINES.ko.md",
    "guide": "agent-judgement",
    "tools": [
     "hueflow.execute_ruby",
     "sketchup-mcp2.find_components"
    ]
   }
  ],
  "method": "component",
  "method_ko": "외부/라이브러리 컴포넌트를 한 블럭으로 배치(내부 분해 금지)",
  "nesting": "definition",
  "ruby_hint": "scripts/sketchup/regroup_0914.rb (태그·레벨·블럭 재구성, 기본 미리보기)",
  "sketchup_kind": "component"
 },
 "review_state": "unverified",
 "schema": "sion-bim-asset/1",
 "source": {
  "definition": "ch5",
  "guid": "91051e0d-e839-4d1b-bd50-77cb9f8126b1",
  "instance_pids": [
   4360580,
   4360581,
   4360582,
   4360583,
   4360584,
   4360585,
   4360586,
   4360587,
   4360622,
   4360623,
   4360624
  ],
  "instances": 11,
  "kind": "component",
  "source_file": null,
  "used_instances": 11
 },
 "tag": {
  "current": [
   "Layer0"
  ],
  "inner_layers": [
   "Layer0"
  ],
  "proposed_zium": "@FUR"
 }
}
