{
 "asset_file": null,
 "asset_id": "su-inst:0914-meeting:4163476@105",
 "basis_ko": "이름 없는 하위 그룹으로, 1단계 위 '그룹167#1'의 분류 'window-louver'를 상속(부품으로 추정). 근거: 월드 크기 0.94×0.10×0.09 m, 최소 Z 11,330 mm, 깊이 6, 면 6개, 재질 없음.",
 "block": false,
 "card_kind": "instance",
 "class": "window-louver",
 "confidence": 0.55,
 "definition_ref": "su-def:0914-meeting:5e38a976-b64c-4f9b-bc81-d02d378dbd02",
 "ifc": {
  "bsdd_uri": "https://identifier.buildingsmart.org/uri/buildingsmart/ifc/4.3/class/IfcWindow",
  "entity": "IfcWindow",
  "predefined_type": "WINDOW"
 },
 "inside_block": false,
 "level": {
  "base_z_mm": 11330.0,
  "elevation_mm": 10200.0,
  "matched": false,
  "name": "2 FL +10200"
 },
 "materials": [],
 "model": "0914-meeting",
 "parameters": {
  "count": 1,
  "faces_recursive": 6,
  "height_mm": 87.7,
  "length_mm": 940.0,
  "thickness_mm": 87.7,
  "transformation": [
   1.0,
   0.0,
   0.0,
   0.0,
   0.0,
   1.0,
   0.0,
   0.0,
   0.0,
   0.0,
   1.0,
   0.0,
   0.0,
   0.0,
   0.0,
   1.0
  ],
  "width_mm": 100.0,
  "world_bbox_mm": {
   "max": [
    77376.3,
    9107.4,
    11417.7
   ],
   "min": [
    76436.3,
    9007.4,
    11330.0
   ],
   "size": [
    940.0,
    100.0,
    87.7
   ]
  }
 },
 "provenance": {
  "classification": "classification.supplement.json",
  "generator": "scripts/sketchup/build_bim_cards.py",
  "hierarchy": "data/sources/sketchup/0914-meeting/hierarchy.json"
 },
 "recipe": {
  "child_definitions": [],
  "class_recipe": "data/assets/sketchup/recipes/window-louver.json",
  "guides": [
   {
    "doc": "docs/sketchup/GROUPING-WORKFLOW.ko.md",
    "guide": "nest-by-assembly",
    "tools": [
     "hueflow.list_entities",
     "hueflow.execute_ruby"
    ]
   },
   {
    "doc": "docs/sketchup/GROUPING-WORKFLOW.ko.md",
    "guide": "component-for-repeats",
    "tools": [
     "sketchup-mcp2.find_components",
     "sketchup-mcp2.get_component_info",
     "sketchup-mcp2.create_component",
     "hueflow.place_component"
    ]
   },
   {
    "doc": "docs/sketchup/GROUPING-WORKFLOW.ko.md",
    "guide": "rotated-frames",
    "tools": [
     "hueflow.rotate_entity",
     "sketchup-mcp2.transform_component",
     "hueflow.execute_ruby"
    ]
   },
   {
    "doc": "docs/sketchup/GROUPING-WORKFLOW.ko.md",
    "guide": "glue-and-cut",
    "tools": [
     "hueflow.execute_ruby",
     "sketchup-mcp2.get_component_info"
    ]
   },
   {
    "doc": "docs/sketchup/GROUPING-WORKFLOW.ko.md",
    "guide": "step-envelope-assemblies",
    "tools": [
     "hueflow.execute_ruby",
     "hueflow.create_group",
     "sketchup-mcp2.create_component"
    ]
   },
   {
    "doc": "docs/sketchup/MODELING-GUIDELINES.ko.md",
    "guide": "doors-windows",
    "tools": [
     "hueflow.execute_ruby",
     "sketchup-mcp2.create_component",
     "hueflow.place_component"
    ]
   },
   {
    "doc": "docs/sketchup/MODELING-GUIDELINES.ko.md",
    "guide": "agent-judgement",
    "tools": [
     "hueflow.execute_ruby",
     "sketchup-mcp2.find_components"
    ]
   }
  ],
  "method": "array",
  "method_ko": "단위 부재(단·멀리언·패널) 하나를 그룹으로 만든 뒤 복사 배열(Move+Ctrl, xN)",
  "nesting": "depth-6",
  "ruby_hint": "scripts/sketchup/regroup_0914.rb (태그·레벨·블럭 재구성, 기본 미리보기)",
  "sketchup_kind": "Group"
 },
 "review_state": "unverified",
 "schema": "sion-bim-asset/1",
 "source": {
  "definition": "그룹189#1",
  "depth": 6,
  "hierarchy_locator": "$.nodes[105]",
  "name": null,
  "occurrence": 105,
  "parent_pid": 4163488,
  "path": "그룹#201 > 그룹#161 > 그룹#101 > 그룹#76 > 그룹#79 > 그룹167#1 > 그룹189#1",
  "pid": 4163476,
  "type": "Group"
 },
 "tag": {
  "current": [
   "Layer0"
  ],
  "proposed_zium": "@win"
 }
}
