{
 "asset_file": null,
 "asset_id": "su-inst:0914-meeting:4360589@216",
 "basis_ko": "정의 카드 su-def:0914-meeting:c187ac0d-d871-4a77-9646-ae31472208d1 분류 상속: 수평면 618.6 m²(레벨 10 mm), 지붕·Douglas Fir 면, 25.7×27.3×0.47 m(월드 z 9750)",
 "block": false,
 "card_kind": "instance",
 "class": "floor-slab",
 "confidence": 0.6,
 "definition_ref": "su-def:0914-meeting:c187ac0d-d871-4a77-9646-ae31472208d1",
 "ifc": {
  "bsdd_uri": "https://identifier.buildingsmart.org/uri/buildingsmart/ifc/4.3/class/IfcSlab",
  "entity": "IfcSlab",
  "predefined_type": "FLOOR"
 },
 "inside_block": false,
 "level": {
  "base_z_mm": 9750.0,
  "elevation_mm": 10200.0,
  "matched": true,
  "name": "2 FL +10200"
 },
 "materials": [],
 "model": "0914-meeting",
 "parameters": {
  "count": 1,
  "faces_recursive": 41,
  "height_mm": 470.0,
  "length_mm": 27300.0,
  "thickness_mm": 470.0,
  "transformation": [
   1.0,
   0.0,
   0.0,
   0.0,
   0.0,
   1.0,
   0.0,
   0.0,
   0.0,
   0.0,
   1.0,
   0.0,
   0.0,
   0.0,
   -6.29921,
   1.0
  ],
  "width_mm": 25700.0,
  "world_bbox_mm": {
   "max": [
    84956.3,
    46407.4,
    10220.0
   ],
   "min": [
    59256.3,
    19107.4,
    9750.0
   ],
   "size": [
    25700.0,
    27300.0,
    470.0
   ]
  }
 },
 "provenance": {
  "classification": "hierarchy class_guess / definition card",
  "generator": "scripts/sketchup/build_bim_cards.py",
  "hierarchy": "data/sources/sketchup/0914-meeting/hierarchy.json"
 },
 "recipe": {
  "child_definitions": [],
  "class_recipe": "data/assets/sketchup/recipes/floor-slab.json",
  "guides": [
   {
    "doc": "docs/sketchup/GROUPING-WORKFLOW.ko.md",
    "guide": "nest-by-assembly",
    "tools": [
     "hueflow.list_entities",
     "hueflow.execute_ruby"
    ]
   },
   {
    "doc": "docs/sketchup/GROUPING-WORKFLOW.ko.md",
    "guide": "level-stacking",
    "tools": [
     "hueflow.execute_ruby",
     "sketchup-mcp2.list_components"
    ]
   },
   {
    "doc": "docs/sketchup/GROUPING-WORKFLOW.ko.md",
    "guide": "glue-and-cut",
    "tools": [
     "hueflow.execute_ruby",
     "sketchup-mcp2.get_component_info"
    ]
   },
   {
    "doc": "docs/sketchup/GROUPING-WORKFLOW.ko.md",
    "guide": "step-building-container",
    "tools": [
     "hueflow.create_group",
     "hueflow.create_box",
     "hueflow.push_pull",
     "hueflow.execute_ruby"
    ]
   },
   {
    "doc": "docs/sketchup/MODELING-GUIDELINES.ko.md",
    "guide": "workflow",
    "tools": [
     "hueflow.execute_ruby",
     "sketchup-mcp2.find_components"
    ]
   },
   {
    "doc": "docs/sketchup/MODELING-GUIDELINES.ko.md",
    "guide": "levels",
    "tools": [
     "sketchup-mcp2.list_components",
     "hueflow.execute_ruby"
    ]
   },
   {
    "doc": "docs/sketchup/MODELING-GUIDELINES.ko.md",
    "guide": "slab",
    "tools": [
     "hueflow.create_box",
     "hueflow.create_face",
     "hueflow.push_pull",
     "hueflow.execute_ruby"
    ]
   },
   {
    "doc": "docs/sketchup/MODELING-GUIDELINES.ko.md",
    "guide": "materials",
    "tools": [
     "hueflow.list_materials",
     "sketchup-mcp2.set_material",
     "hueflow.execute_ruby"
    ]
   },
   {
    "doc": "docs/sketchup/MODELING-GUIDELINES.ko.md",
    "guide": "qa",
    "tools": [
     "sketchup-mcp2.get_model_info",
     "sketchup-mcp2.list_components",
     "sketchup-mcp2.get_component_info",
     "hueflow.execute_ruby",
     "sketchup-mcp2.export_scene"
    ]
   },
   {
    "doc": "docs/sketchup/MODELING-GUIDELINES.ko.md",
    "guide": "mcp-execution",
    "tools": [
     "sketchup-mcp2.get_model_info",
     "sketchup-mcp2.list_components",
     "sketchup-mcp2.find_components",
     "sketchup-mcp2.get_component_info",
     "sketchup-mcp2.create_component",
     "sketchup-mcp2.transform_component",
     "sketchup-mcp2.set_material",
     "sketchup-mcp2.create_layer",
     "sketchup-mcp2.export_scene",
     "sketchup-mcp2.eval_ruby",
     "sketchup-mcp2.undo",
     "hueflow.execute_ruby",
     "hueflow.create_box",
     "hueflow.create_group",
     "hueflow.place_component",
     "hueflow.list_materials"
    ]
   },
   {
    "doc": "docs/sketchup/MODELING-GUIDELINES.ko.md",
    "guide": "agent-judgement",
    "tools": [
     "hueflow.execute_ruby",
     "sketchup-mcp2.find_components"
    ]
   }
  ],
  "method": "extrude",
  "method_ko": "평면 윤곽을 그린 뒤 push/pull로 두께·높이만큼 돌출",
  "nesting": "depth-3",
  "ruby_hint": "scripts/sketchup/regroup_0914.rb (태그·레벨·블럭 재구성, 기본 미리보기)",
  "sketchup_kind": "Group"
 },
 "review_state": "unverified",
 "schema": "sion-bim-asset/1",
 "source": {
  "definition": "그룹#213",
  "depth": 3,
  "hierarchy_locator": "$.nodes[216]",
  "name": null,
  "occurrence": 216,
  "parent_pid": 4361373,
  "path": "그룹#201 > 그룹#202 > 그룹#205 > 그룹#213",
  "pid": 4360589,
  "type": "Group"
 },
 "tag": {
  "current": [
   "Layer0"
  ],
  "proposed_zium": "A-본동"
 }
}
