{
 "asset_file": null,
 "asset_id": "su-inst:0914-meeting:4164453@133",
 "basis_ko": "정의 카드 su-def:0914-meeting:c305bfe8-d89f-4ff7-9ec4-947dec42e27e 분류 상속: 이름 'D=15 mm', 15×13.5×889 mm 난간동자, XCLINE 태그 모서리 1개, 인스턴스(그룹 복사본) 29개",
 "block": false,
 "card_kind": "instance",
 "class": "handrail",
 "confidence": 0.7,
 "definition_ref": "su-def:0914-meeting:c305bfe8-d89f-4ff7-9ec4-947dec42e27e",
 "ifc": {
  "bsdd_uri": "https://identifier.buildingsmart.org/uri/buildingsmart/ifc/4.3/class/IfcRailing",
  "entity": "IfcRailing",
  "predefined_type": "HANDRAIL"
 },
 "inside_block": false,
 "level": {
  "base_z_mm": 5000.0,
  "elevation_mm": 5000.0,
  "matched": true,
  "name": "1 FL +5000"
 },
 "materials": [],
 "model": "0914-meeting",
 "parameters": {
  "count": 1,
  "faces_recursive": 34,
  "height_mm": 889.0,
  "length_mm": 15.0,
  "thickness_mm": 13.5,
  "transformation": [
   1.0,
   0.0,
   0.0,
   0.0,
   0.0,
   1.0,
   0.0,
   0.0,
   0.0,
   0.0,
   1.0,
   0.0,
   0.0,
   103.93701,
   0.0,
   1.0
  ],
  "width_mm": 13.5,
  "world_bbox_mm": {
   "max": [
    62863.8,
    16440.3,
    5889.0
   ],
   "min": [
    62848.8,
    16426.7,
    5000.0
   ],
   "size": [
    15.0,
    13.5,
    889.0
   ]
  }
 },
 "provenance": {
  "classification": "hierarchy class_guess / definition card",
  "generator": "scripts/sketchup/build_bim_cards.py",
  "hierarchy": "data/sources/sketchup/0914-meeting/hierarchy.json"
 },
 "recipe": {
  "child_definitions": [],
  "class_recipe": "data/assets/sketchup/recipes/handrail.json",
  "guides": [
   {
    "doc": "docs/sketchup/GROUPING-WORKFLOW.ko.md",
    "guide": "component-for-repeats",
    "tools": [
     "sketchup-mcp2.find_components",
     "sketchup-mcp2.get_component_info",
     "sketchup-mcp2.create_component",
     "hueflow.place_component"
    ]
   },
   {
    "doc": "docs/sketchup/GROUPING-WORKFLOW.ko.md",
    "guide": "default-naming",
    "tools": [
     "sketchup-mcp2.list_components",
     "hueflow.list_components",
     "hueflow.execute_ruby"
    ]
   },
   {
    "doc": "docs/sketchup/GROUPING-WORKFLOW.ko.md",
    "guide": "tags-on-raw-geometry",
    "tools": [
     "hueflow.list_layers",
     "sketchup-mcp2.list_layers",
     "hueflow.execute_ruby"
    ]
   },
   {
    "doc": "docs/sketchup/GROUPING-WORKFLOW.ko.md",
    "guide": "step-site-assemblies",
    "tools": [
     "hueflow.create_group",
     "hueflow.move_entity",
     "hueflow.rotate_entity",
     "hueflow.execute_ruby"
    ]
   },
   {
    "doc": "docs/sketchup/GROUPING-WORKFLOW.ko.md",
    "guide": "step-repeats",
    "tools": [
     "sketchup-mcp2.create_component",
     "sketchup-mcp2.find_components",
     "sketchup-mcp2.transform_component",
     "hueflow.place_component",
     "hueflow.execute_ruby"
    ]
   },
   {
    "doc": "docs/sketchup/MODELING-GUIDELINES.ko.md",
    "guide": "tags",
    "tools": [
     "hueflow.list_layers",
     "sketchup-mcp2.list_layers",
     "sketchup-mcp2.create_layer",
     "hueflow.execute_ruby"
    ]
   },
   {
    "doc": "docs/sketchup/MODELING-GUIDELINES.ko.md",
    "guide": "group-component",
    "tools": [
     "sketchup-mcp2.find_components",
     "sketchup-mcp2.get_component_info",
     "hueflow.list_components",
     "hueflow.place_component",
     "hueflow.execute_ruby"
    ]
   },
   {
    "doc": "docs/sketchup/MODELING-GUIDELINES.ko.md",
    "guide": "exterior-stair",
    "tools": [
     "hueflow.execute_ruby",
     "hueflow.create_face",
     "hueflow.push_pull"
    ]
   },
   {
    "doc": "docs/sketchup/MODELING-GUIDELINES.ko.md",
    "guide": "railing",
    "tools": [
     "hueflow.follow_me",
     "hueflow.execute_ruby",
     "hueflow.create_circle"
    ]
   },
   {
    "doc": "docs/sketchup/MODELING-GUIDELINES.ko.md",
    "guide": "agent-judgement",
    "tools": [
     "hueflow.execute_ruby",
     "sketchup-mcp2.find_components"
    ]
   }
  ],
  "method": "follow-me",
  "method_ko": "단면(원/사각)을 경로를 따라 Follow-Me로 쓸어 만듦",
  "nesting": "depth-4",
  "ruby_hint": "scripts/sketchup/regroup_0914.rb (태그·레벨·블럭 재구성, 기본 미리보기)",
  "sketchup_kind": "Group"
 },
 "review_state": "unverified",
 "schema": "sion-bim-asset/1",
 "source": {
  "definition": "그룹#57",
  "depth": 4,
  "hierarchy_locator": "$.nodes[133]",
  "name": "D=15 mm",
  "occurrence": 133,
  "parent_pid": 4168073,
  "path": "그룹#201 > 그룹#67 > 그룹#64 > 그룹#68 > D=15 mm",
  "pid": 4164453,
  "type": "Group"
 },
 "tag": {
  "current": [
   "Layer0"
  ],
  "proposed_zium": "@stair"
 }
}
